Name,Link,Rating,Price,Discount,Pack,Ingredients,Discription
Neem Body Scrub with Neem & Tulsi for Skin Purification – 200 g,https://mamaearth.in/product/neem-body-scrub-with-neem-tulsi-for-skin-purification-200-g,5,499,0%,200g,"['neem', 'tulsi', 'walnut']",Neem Body Scrub with Neem & Tulsi for Skin Purification – 200 g
Hand Sanitizer with Lime & Neem for Killing Germs – 250 ml,https://mamaearth.in/product/hand-sanitizer-with-lime-neem-for-killing-germs-250-ml,5,299,0%,250ml,"['neem', 'glycerin', 'lime']",Hand Sanitizer with Lime & Neem for Killing Germs – 250 ml
Vitamin C Night  Regimen Combo,https://mamaearth.in/product/vitamin-c-night-regimen-combo,5,1749,5%,null,"['vitamin c', 'turmeric', 'aloe vera', 'squalane']",Vitamin C Night  Regimen Combo
Vitamin C Day Regimen Combo,https://mamaearth.in/product/vitamin-c-day-regimen-combo,5,1549,11%,null,"['vitamin c', 'turmeric', 'aloe vera', 'cucumber']",Vitamin C Day Regimen Combo
BhringAmla Conditioner with Bhringraj & Amla for Intense Hair Treatment – 250ml,https://mamaearth.in/product/bhringamla-conditioner-with-bhringraj-amla-for-intense-hair-treatment-250ml,4.9,349,0%,250ml,"['bhringraj', 'amla', 'sweet almond oil']",BhringAmla Conditioner with Bhringraj & Amla for Intense Hair Treatment – 250ml
BhringAmla Shampoo with Bhringraj & Amla for Intense Hair Treatment – 250 ml,https://mamaearth.in/product/bhringamla-shampoo-with-bhringraj-amla-for-intense-hair-treatment-250-ml,5,349,0%,250ml,"['bhringraj', 'amla', 'shikakai', 'brahmi']",BhringAmla Shampoo with Bhringraj & Amla for Intense Hair Treatment – 250 ml
BhringAmla Hair Oil with Bhringraj & Amla for Intense Hair Treatment – 250ml,https://mamaearth.in/product/bhringamla-hair-oil-with-bhringraj-amla-for-intense-hair-treatment-250ml,4.9,499,0%,250ml,"['bhringraj', 'amla', 'brahmi', 'baheda']",BhringAmla Hair Oil with Bhringraj & Amla for Intense Hair Treatment – 250ml
Tan Removal Regimen,https://mamaearth.in/product/tan-removal-regimen,4.9,799,27%,null,"['turmeric', 'walnut beads', 'sa?ron', 'carrot oil']","Tan Removal RegimenDon’t let the harsh sun make your skin look dull and dry. Fall in love with your skin all over again with the traditional goodness of Ubtan. Make Mamaearth Tan Removal Regimen a part of your everyday skin routine and make your skin glow throughout summer and beyond. Ubtan Face Wash and Scrub ensure that dirt, impurity, and tan is nowhere on your skin. Meanwhile, the face mask ensures that your skin glows and remains nourished.Infused with the goodness of nature, all the products in this kit are dermatologically tested. These products do not contain any harmful chemicals like Parabens, SLES, sulfates, silicones, phthalates, and artificial fragrances.Ubtan Face Wash - 100mlUbtan Face Scrub - 100gUbtan Face Mask - 100ml"
HydraGel Indian Sunscreen with Aloe Vera & Raspberry for Sun Protection - 50 g,https://mamaearth.in/product/hydragel-indian-sunscreen-with-aloe-vera-raspberry-for-sun-protection-50-g,5,399,0%,50g,"['aloe vera', 'raspberry', 'glycerin']",HydraGel Indian Sunscreen with Aloe Vera & Raspberry for Sun Protection - 50 g
Vitamin C Face Wash with Vitamin C and Turmeric for Skin Illumination – 100ml,https://mamaearth.in/product/vitamin-c-face-wash-with-vitamin-c-and-turmeric-for-skin-illumination-100ml,5,249,0%,100ml,"['vitamin c', 'turmeric', 'aloe vera']",Vitamin C Face Wash with Vitamin C and Turmeric for Skin Illumination – 100ml
Vitamin C Face Cream with Vitamin C & SPF 20 for Skin Illumination – 50g,https://mamaearth.in/product/vitamin-c-face-cream-with-vitamin-c-spf-20-for-skin-illumination-50g,5,599,0%,50g,"['vitamin c', 'niacinamide', 'common purslane']",Vitamin C Face Cream with Vitamin C & SPF 20 for Skin Illumination – 50g
Vitamin C Face Mask With Vitamin C & Kaolin Clay for Skin Illumination - 100 g,https://mamaearth.in/product/vitamin-c-face-mask-with-vitamin-c-kaolin-clay-for-skin-illumination-100-g,5,499,0%,100g,"['vitamin c', 'kaolin clay', 'glycerin', 'turmeric']","Vitamin C Face Mask With Vitamin C & Kaolin Clay for Skin Illumination - 100 gWe all dream of bright and spotless skin. But the hustle of daily life often takes a toll on our skin’s health. Dirt, pollution, UV rays, and extreme weather conditions damage the skin while stealing its natural glow.Mamaearth Vitamin C Face Mask will help bring back that radiance! Power-packed with the goodness of Vitamin C and Kaolin Clay, it will make your skin bright, healthy, and spotless.The product is dermatologically tested and is suitable for all skin types. It contains no Parabens, harmful chemicals, toxins, or mineral oils and is 100% safe to add to your skincare regimen."
CoCo Face Wash with Coffee & Cocoa for Skin Awakening – 100ml,https://mamaearth.in/product/coco-face-wash-with-coffee-and-cocoa-for-skin-awakening-100ml,5,249,0%,100ml,"['coffee', 'cocoa']",CoCo Face Wash with Coffee & Cocoa for Skin Awakening – 100ml
CoCo Face Scrub with Coffee & Cocoa for Rich Exfoliation - 100g,https://mamaearth.in/product/coco-face-scrub-with-coffee-cocoa-for-rich-exfoliation-100g,4.9,349,0%,100g,"['coffee', 'cocoa', 'shea butter']",CoCo Face Scrub with Coffee & Cocoa for Rich Exfoliation - 100g
CoCo Face Mask with Coffee & Cocoa for Skin Awakening – 100g,https://mamaearth.in/product/coco-face-mask-with-coffee-cocoa-for-skin-awakening-100g,4.9,499,0%,100g,"['coffee', 'cocoa', 'glycerin']",CoCo Face Mask with Coffee & Cocoa for Skin Awakening – 100g
Vitamin C Sleeping Mask with Aloe Vera for Skin Illumination - 100 g,https://mamaearth.in/product/vitamin-c-sleeping-mask-with-aloe-vera-for-skin-illumination-100-g,5,599,0%,100g,"['vitamin c', 'aloe vera']",Vitamin C Sleeping Mask with Aloe Vera for Skin Illumination - 100 g
Ubtan Yogurt with Turmeric and Saffron for Deep Moisturization – 200 ml,https://mamaearth.in/product/ubtan-yogurt-with-turmeric-and-saffron-for-deep-moisturization-200ml,5,499,0%,200ml,"['turmeric', 'saffron', 'glycerin']",Ubtan Yogurt with Turmeric and Saffron for Deep Moisturization – 200 ml
"Niacin Toner For Face, with Niacinamide & With Hazel for Acne and Open Pores - 200 ml",https://mamaearth.in/product/niacin-toner-for-face-with-niacinamide-with-hazel-for-acne-and-open-pores-200-ml,5,399,0%,200ml,"['niacinamide', 'witch hazel', 'aloe vera', 'citric acid']","Niacin Toner For Face, with Niacinamide & With Hazel for Acne and Open Pores - 200 mlIt’s time to bid farewell to open pores, acne marks, & damaged skin. Mamaearth Niacin Face Toner is formulated with the power of Niacinamide and the goodness of Witch Hazel to give you clear and healthy skin. Stop free radical damage and tighten enlarged pores with this clarifying and hydrating toner.Mamaearth Niacin Face Toner tightens the pores without over-drying your skin. Its antioxidant properties will reduce blemishes and other dark spots to give you a more even-toned complexion.This toner is dermatologically tested to improve the overall skin texture by reducing acne marks and enlarged pores. It can be used by all skin types and is free of harsh chemicals, SLS, Parabens, and Mineral Oils."
Argan Conditioner with Argan & Apple Cider Vinegar for Frizz-Free and Stronger Hair - 250ml,https://mamaearth.in/product/argan-conditioner-with-argan-apple-cider-vinegar-for-frizz-free-and-stronger-hair,5,349,0%,250ml,"['argan oil', 'apple cider vinegar', 'almond oil']",Argan Conditioner with Argan & Apple Cider Vinegar for Frizz-Free and Stronger Hair - 250ml
Argan Shampoo with Argan & Apple Cider Vinegar for Frizz-free & Stronger Hair - 250 ml,https://mamaearth.in/product/argan-shampoo-with-argan-apple-cider-vinegar-for-frizz-free-stronger-hair,4.8,349,0%,250ml,"['argan oil', 'apple cider vinegar', 'vitamin e']",Argan Shampoo with Argan & Apple Cider Vinegar for Frizz-free & Stronger Hair - 250 ml
Onion Shampoo 400ml + Onion Conditioner 250ml,https://mamaearth.in/product/onion-shampoo-400ml-onion-conditioner-250ml,5,884,3%,400ml,"['onion seed oil', 'd-panthenol', 'keratin', 'vitamin e']",Onion Shampoo 400ml + Onion Conditioner 250ml
Onion Hair Oil + Onion Hair Mask,https://mamaearth.in/product/onion-hair-oil-onion-hair-mask,5,998,0%,null,"['onion oil', 'organic bamboo vinegar', 'coconut oil', 'rosemary oil']",Onion Hair Oil + Onion Hair Mask
Onion Hair Serum + Onion Hair Oil,https://mamaearth.in/product/onion-hair-serum-onion-hair-oil,5,679,3%,null,"['onion seed extract', 'biotin', 'olive oil', 'd-panthenol']",Onion Hair Serum + Onion Hair Oil
Onion Hair Serum + Onion Hair Mask,https://mamaearth.in/product/onion-hair-serum-onion-hair-mask,5,874,3%,null,"['onion seed extract', 'biotin', 'olive oil', 'd-panthenol']",Onion Hair Serum + Onion Hair Mask
Ubtan Face Wash + Skin Illuminate Face Serum,https://mamaearth.in/product/ubtan-face-wash-skin-illuminate-face-serum,5,824,3%,null,"['turmeric', 'walnut beads', 'licorice extract', 'carrot oil']",Ubtan Face Wash + Skin Illuminate Face Serum
Skin Illuminate Face Serum + Bye Bye Blemishes 30g,https://mamaearth.in/product/skin-illuminate-face-serum-bye-bye-blemishes-30g,5,999,5%,30g,"['vitamin c', 'nymphaea alba flower extract', 'turmeric', 'squalane']",Skin Illuminate Face Serum + Bye Bye Blemishes 30g
Skin Illuminate Face Serum + Bye Bye Dark Circles,https://mamaearth.in/product/skin-illuminate-face-serum-bye-bye-dark-circles,5,969,3%,null,"['vitamin c', 'nymphaea alba flower extract', 'turmeric', 'squalane']",Skin Illuminate Face Serum + Bye Bye Dark Circles
Bye Bye Blemishes 30g + Bye Bye Dark Circles,https://mamaearth.in/product/bye-bye-blemishes-30g-bye-bye-dark-circles,5,824,3%,30g,"['vitamin c', 'daisy flower extract', 'licorice extract', 'mulberry extract']",Bye Bye Blemishes 30g + Bye Bye Dark Circles
"Stretch Marks Cream, 100ml",https://mamaearth.in/product/stretch-marks-removal-cream,4.6,500,0%,100ml,"['milk protein', 'shea butter', 'peptides']","Stretch Marks Cream, 100ml"
Tea Tree Face Wash + Bye Bye Blemishes 30ml,https://mamaearth.in/product/tea-tree-face-wash-bye-bye-blemishes-30ml,5,679,2%,30ml,"['neem', 'aloe vera', 'tea tree oil']",Tea Tree Face Wash + Bye Bye Blemishes 30ml
"Onion Hair Oil for Hair Regrowth & Hair Fall Control, 250ml",https://mamaearth.in/product/onion-hair-oil-for-hair-regrowth-hair-fall-control-with-redensyl-250ml,5,599,0%,250ml,"['onion seed oil', 'redensyl', 'almond oil', 'bhringraj oil']","Onion Hair Oil for Hair Regrowth & Hair Fall Control, 250ml"
"Charcoal Face Scrub For Oily Skin & Normal skin, with Charcoal & Walnut for Deep Exfoliation – 100g",https://mamaearth.in/product/charcoal-face-scrub-for-oily-skin-normal-skin-with-charcoal-walnut-for-deep-exfoliation-100g,4.8,349,0%,100g,"['activated charcoal', 'walnut', 'tea tree']","Charcoal Face Scrub For Oily Skin & Normal skin, with Charcoal & Walnut for Deep Exfoliation – 100g"
Ubtan Face Scrub with Turmeric & Walnut for Tan Removal - 100g,https://mamaearth.in/product/ubtan-scrub-for-face-with-turmeric-walnut-for-tan-removal-100g,4.9,349,0%,100g,"['turmeric', 'walnut', 'coconut oil', 'sa?ron']",Ubtan Face Scrub with Turmeric & Walnut for Tan Removal - 100g
"Vitamin C Face Toner with Vitamin C & Cucumber for Pore Tightening, 200 ml",https://mamaearth.in/product/vitamin-c-face-toner-with-vitamin-c-cucumber-for-pore-tightening-200-ml,4.8,399,0%,200ml,"['vitamin c', 'cucumber', 'aloe vera extract', 'witch hazel']","Vitamin C Face Toner with Vitamin C & Cucumber for Pore Tightening, 200 mlThe second step in a skincare routine, toning helps clean leftover impurities and excess oil from the face. Regular application of toner helps tighten and cleanse pores from within while protecting the skin from acne and breakouts. Mamaearth Vitamin C toner has a unique alcohol-free formula and comes loaded with the goodness of Aloe Vera, Cucumber, Witch Hazel, and many other hardworking ingredients. Vitamin C in this toner supports the production of healthy collagen that brightens the complexion and boosts skin’s firmness. Witch Hazel reduces inflammation, tightens skin pores, and soothes acne-prone sensitive skin. The alcohol-free formula of this toner helps balance the pH level of your skin. Cucumber, a trusted skincare ingredient, offers hydration, reduces inflammation, and calms irritated skin. Mamaearth Vitamin C Face Toner is suitable for all skin types & free of alcohol & harmful toxins such as Parabens, Mineral Oil, Silicones, etc."
Aloe Vera Gel with Pure Aloe Vera & Vitamin E for Skin and Hair - 300ml,https://mamaearth.in/product/aloe-vera-gel-for-face-with-pure-aloe-vera-vitamin-e-for-skin-and-hair-300ml,5,399,0%,300ml,"['aloe vera', 'vitamin e', 'glycerin']",Aloe Vera Gel with Pure Aloe Vera & Vitamin E for Skin and Hair - 300ml
"Onion Hair Serum with Onion & Biotin for Strong, Frizz-Free Hair – 100 ml",https://mamaearth.in/product/onion-hair-serum-with-onion-biotin-for-strong-frizz-free-hair-100-ml,4.9,299,0%,100ml,"['onion seed extract', 'biotin', 'olive oil', 'd-panthenol']","Onion Hair Serum with Onion & Biotin for Strong, Frizz-Free Hair – 100 ml"
 Skin Correct Face Serum with Niacinamide and Ginger Extract for Acne Marks & Scars – 30 ml,https://mamaearth.in/product/skin-correct-face-serum-with-niacinamide-and-ginger-extract-for-acne-marks-scars-30-ml,5,599,0%,30ml,"['niacinamide', 'ginger extract', 'zinc pca', 'glycerin']", Skin Correct Face Serum with Niacinamide and Ginger Extract for Acne Marks & Scars – 30 ml
Tea Tree Face Wash + Charcoal Face Wash,https://mamaearth.in/product/tea-tree-face-wash-charcoal-face-wash,5,489,2%,null,"['neem', 'aloe vera', 'tea tree oil']",Tea Tree Face Wash + Charcoal Face Wash
 Ubtan Face Wash + Tea Tree Face Wash ,https://mamaearth.in/product/ubtan-face-wash-tea-tree-face-wash-pack-of-2,5,489,2%,null,"['neem', 'tea tree', 'saffron', 'turmeric']", Ubtan Face Wash + Tea Tree Face Wash 
" Ubtan Facewash for tan removal, Pack Of 2 ",https://mamaearth.in/product/ubtan-facewash-for-tan-removal-pack-of-2,5,489,2%,null,"['turmeric', 'walnut beads', 'licorice extract', 'carrot oil']"," Ubtan Facewash for tan removal, Pack Of 2 "
"Tea Tree Facewash for acne and pimples, Pack Of 2 ",https://mamaearth.in/product/tea-tree-facewash-for-acne-and-pimples-pack-of-2,5,489,2%,null,"['neem', 'aloe vera', 'tea tree oil']","Tea Tree Facewash for acne and pimples, Pack Of 2 "
"Charcoal Facewash for oil control, Pack Of 2 ",https://mamaearth.in/product/charcoal-facewash-for-oil-control-pack-of-2,4.9,489,2%,null,"['charcoal', 'clay', 'coffee', 'tea tree oil']","Charcoal Facewash for oil control, Pack Of 2 "
Skin Illuminate Face Serum for Radiant Skin with Vitamin C & Turmeric – 30 gm,https://mamaearth.in/product/skin-illuminate-face-serum-for-radiant-skin-with-vitamin-c-turmeric-30-gm,4.9,599,0%,null,"['vitamin c', 'nymphaea alba flower extract', 'turmeric', 'squalane']","Skin Illuminate Face Serum for Radiant Skin with Vitamin C & Turmeric – 30 gmMamaearth Skin Illuminate Face Serum is free of harmful toxins such as Parabens, Mineral Oil, Silicones, etc."
Bye Bye Dark Circles Eye Cream with Cucumber & Peptides for Dark Circles – 20ml,https://mamaearth.in/product/bye-bye-dark-circles-eye-cream-with-cucumber-peptides-for-dark-circles-20ml,5,399,0%,20ml,"['cucumber extract', 'daisy flower extract', 'peptides', 'hawkweed extract']",Bye Bye Dark Circles Eye Cream with Cucumber & Peptides for Dark Circles – 20ml
Mamaearth Epsom Bath Salt for Relaxation and Pain Relief - 200 gm,https://mamaearth.in/product/buy-epsom-salt-online,5,399,0%,null,"['magnesium', 'detoxifying sulphates', 'lavender oil']",Mamaearth Epsom Bath Salt for Relaxation and Pain Relief - 200 gm
"Onion Hair Mask, For Hair Fall Control, With Onion Oil and Organic Bamboo Vinegar, 200ml",https://mamaearth.in/product/onion-hair-mask-for-hair-fall-control-with-onion-oil-organic-bamboo-vinegar-200ml,5,599,0%,200ml,"['onion oil', 'organic bamboo vinegar', 'coconut oil', 'rosemary oil']","Onion Hair Mask, For Hair Fall Control, With Onion Oil and Organic Bamboo Vinegar, 200ml"
"Onion Hair Oil for Hair Regrowth and Hair Fall Control with Redensyl, 150ml",https://mamaearth.in/product/onion-hair-oil-for-hair-regrowth-hair-fall-control-with-redensyl-150ml,4.9,399,0%,150ml,"['onion seed oil', 'redensyl', 'almond oil', 'bhringraj oil', 'amla oil', 'castor oil']","Onion Hair Oil for Hair Regrowth and Hair Fall Control with Redensyl, 150ml"
Onion Shampoo for Hair Growth and Hair Fall Control with Onion Oil and Plant Keratin 250 ml,https://mamaearth.in/product/mamaearth-onion-shampoo-for-hair-growth-hair-fall-control-with-onion-oil-plant-keratin-250-ml,4.8,349,0%,250ml,"['onion seed oil', 'd-panthenol', 'keratin', 'vitamin e']",Onion Shampoo for Hair Growth and Hair Fall Control with Onion Oil and Plant Keratin 250 ml
"Onion Conditioner for Hair Growth and Hair Fall Control with Onion and Coconut, 250ml",https://mamaearth.in/product/mamaearth-onion-conditioner-for-hair-growth-hair-fall-control-with-onion-coconut-250ml,4.8,349,0%,250ml,"['onion seed oil', 'coconut', 'almond oil', 'coconut triglycerides']","Onion Conditioner for Hair Growth and Hair Fall Control with Onion and Coconut, 250ml"
"Neem Face Mask with Neem and Tea Tree for Pimples and Zits, 100 ml",https://mamaearth.in/product/neem-face-mask-with-neem-tea-tree-for-pimples-zits-100-ml,5,499,0%,100ml,"['neem oil', 'tea tree oil', 'apricot oil', 'mulberry extract']","Neem Face Mask with Neem and Tea Tree for Pimples and Zits, 100 ml"
Wedding Glow Skincare Kit,https://mamaearth.in/product/wedding-glow-skincare-kit,4.8,899,33%,null,"['saffron', 'turmeric', 'apricot oil', 'cucumber extract']",Wedding Glow Skincare Kit
"Ubtan Body Butter, For Dry Skin, With Turmeric & Honey, For Deep Nourishment – 200g",https://mamaearth.in/product/mamaearth-ubtan-body-butter-for-dry-skin-with-turmeric-honey-for-deep-nourishment-200g,4.9,599,0%,200g,"['turmeric', 'honey', 'shea butter', 'sunflower seed oil']","Ubtan Body Butter, For Dry Skin, With Turmeric & Honey, For Deep Nourishment – 200g"
"CoCo Body Butter for Dry Skin, with Coffee & Cocoa for Deep Moisturization- 200g",https://mamaearth.in/product/mamaearth-coco-body-butter-for-dry-skin-with-coffee-cocoa-for-deep-moisturization-200g,5,599,0%,200g,"['theobroma cocoa seed butter', 'coffee extract', 'shea butter', 'sunflower seed oil']","CoCo Body Butter for Dry Skin, with Coffee & Cocoa for Deep Moisturization- 200g"
"Nipple Butter Cream for sore & cracked nipples, 50ml",https://mamaearth.in/product/natural-nip-care-cream,4.8,500,0%,50ml,"['coconut oil', 'shea butter', 'calendula extract']","Nipple Butter Cream for sore & cracked nipples, 50ml"
"Skin Plump Serum For Face Glow, with Hyaluronic Acid & Rosehip Oil for Ageless Skin - 30ml",https://mamaearth.in/product/skin-plump-serum-for-face-glow-with-hyaluronic-acid-rosehip-oil-for-ageless-skin-30ml,4.8,599,0%,30ml,"['hyaluronic acid', 'rosehip oil', 'olive extract', 'coconut extract']","Skin Plump Serum For Face Glow, with Hyaluronic Acid & Rosehip Oil for Ageless Skin - 30ml"
"Onion Conditioner for Hair Growth and Hair Fall Control with Onion and Coconut, 400ml",https://mamaearth.in/product/onion-conditioner-for-hair-growth-and-hair-fall-control-with-onion-and-coconut-400ml,5,559,0%,400ml,"['onion seed oil', 'coconut', 'almond oil', 'coconut triglycerides']","Onion Conditioner for Hair Growth and Hair Fall Control with Onion and Coconut, 400ml"
Onion Shampoo for Hair Growth and Hair Fall Control with Onion Oil and Plant Keratin 400ml,https://mamaearth.in/product/onion-shampoo-for-hair-growth-and-hair-fall-control-with-onion-oil-and-plant-keratin-400ml,4.9,559,0%,400ml,"['onion seed oil', 'd-panthenol', 'keratin', 'vitamin e']",Onion Shampoo for Hair Growth and Hair Fall Control with Onion Oil and Plant Keratin 400ml
Hair Fall Control Regime Combo: Onion Shampoo 250ml + Onion Hair Mask 200ml,https://mamaearth.in/product/onion-mask-shampoo-combo,5,924,3%,250ml,"['onion oil', 'organic bamboo vinegar', 'coconut oil', 'keratin']",Hair Fall Control Regime Combo: Onion Shampoo 250ml + Onion Hair Mask 200ml
Mamaearth Under Eye Crème with Cucumber & Caffeine for Dark Circles - 50ml,https://mamaearth.in/product/eye-dark-circle-removal,4.9,599,0%,50ml,"['cucumber extract', 'white lily extract', 'coffee extract']",Mamaearth Under Eye Crème with Cucumber & Caffeine for Dark Circles - 50ml
Tea Tree Conditioner with Tea Tree & Ginger Oil for Dandruff Free Hair 250ml,https://mamaearth.in/product/mamaearth-tea-tree-conditioner-with-tea-tree-ginger-oil-for-dandruff-free-hair-250ml,5,349,0%,250ml,"['tea tree oil', 'ginger oil', 'almond oil']","Tea Tree Conditioner with Tea Tree & Ginger Oil for Dandruff Free Hair 250mlStimulate and renew your hair with an outlandish mix of Tea Tree and Ginger Oil that helps in reducing itch & irritation while contributing to the shine and smoothness of the hair and soothing dryness and itchiness. Mamaearth Tea Tree Conditioner is made using natural ingredients and makes sure that dandruff and excess oil are gently worked on & removed.Coconut oil present in the conditioner works like magic on dry and brittle scalp, making hair soft and smooth. Almond Oil nourishes and moisturizes hair while adding shine. Ginger Oil contributes to the health of the hair and soothes dryness. Safe for colored & chemically treated hair, this conditioner is free of harmful chemicals & toxins such as Silicones, Parabens, Mineral Oil, & Dyes."
Hair Fall Control Kit,https://mamaearth.in/product/hairfall-control-kit,4.9,949,32%,null,"['onion seed oil', 'redensyl', 'almond oil', 'bhringraj oil', 'amla oil', 'castor oil']",Hair Fall Control Kit
Bye Bye Blemishes Face Cream for Reducing Pigmentation & Blemishes with Mulberry Extract & Vitamin C – 30ml,https://mamaearth.in/product/bye-bye-blemishes-face-cream-for-pigmentation-blemish-removal-with-mulberry-extract-vitamin-c-30ml,4.9,449,0%,30ml,"['vitamin c', 'daisy flower extract', 'licorice extract', 'mulberry extract']",Bye Bye Blemishes Face Cream for Reducing Pigmentation & Blemishes with Mulberry Extract & Vitamin C – 30ml
" Castor Oil for Healthier Skin, Hair and Nails with 100% Pure and Natural Cold-Pressed Oil, 150ml",https://mamaearth.in/product/100-pure-natural-cold-pressed-castor-oil-for-healthier-skin-hair-nails-150ml,5,299,0%,150ml,['castor oil']," Castor Oil for Healthier Skin, Hair and Nails with 100% Pure and Natural Cold-Pressed Oil, 150ml"
"Hair Regrowth Combo : Onion Shampoo, 250ml + Onion Conditioner, 250ml",https://mamaearth.in/product/hair-regrowth-combo-onion-shampoo-onion-conditioner,4.9,679,3%,250ml,"['onion seed oil', 'd-panthenol', 'keratin', 'vitamin e']","Hair Regrowth Combo : Onion Shampoo, 250ml + Onion Conditioner, 250ml"
Revitalizing Turmeric Kits,https://mamaearth.in/product/revitalizing-turmeric-kit,5,1199,33%,null,"['aloe vera', 'turmeric', 'saffron', 'apricot oil']",Revitalizing Turmeric Kits
Aloe Turmeric Gel for Skin & Hair 150ml,https://mamaearth.in/product/aloe-turmeric-gel-for-skin-hair-150ml,5,249,0%,150ml,"['100% pure aloe vera', 'turmeric', 'vitamin e']",Aloe Turmeric Gel for Skin & Hair 150ml
"Aloe Turmeric Gel for Skin & Hair 300ml (Saver Pack, get 20% extra)",https://mamaearth.in/product/aloe-turmeric-gel-for-skin-hair-300ml,4.9,399,0%,300ml,"['100% pure aloe vera', 'turmeric', 'vitamin e']","Aloe Turmeric Gel for Skin & Hair 300ml (Saver Pack, get 20% extra)"
"Oil-Free Face Moisturizer for Acne-Prone Skin, 80ml",https://mamaearth.in/product/oil-free-face-moisturizer-with-apple-cider-vinegar-for-acne-prone-skin,4.9,299,0%,80ml,"['apple cider vinegar', 'cetearyl octanoate', 'betaine', 'fatty acids']","Oil-Free Face Moisturizer for Acne-Prone Skin, 80ml"
"Anti Acne Combo: Oil Free Moisturizer, 80ml + Ultra Light Indian Sunscreen, 80ml",https://mamaearth.in/product/anti-acne-combo-oil-free-moisturizer-ultra-light-indian-sunscreen,5,774,3%,80ml,"['turmeric', 'carrot seed oil', 'apple cider vinegar', 'betaine']","Anti Acne Combo: Oil Free Moisturizer, 80ml + Ultra Light Indian Sunscreen, 80ml"
"Skin Lightening & Brightening Combo : Ubtan Facemask, 100ml + Ubtan Facewash, 100ml",https://mamaearth.in/product/mamaearth-combos-skin-lightening-and-brightening-combo,4.8,724,3%,100ml,"['saffron', 'turmeric', 'cucumber extract', 'carrot seed oil']","Skin Lightening & Brightening Combo : Ubtan Facemask, 100ml + Ubtan Facewash, 100ml"
"Sun Protection Combo : Sunscreen, 80ml + Ubtan Facewash, 100ml",https://mamaearth.in/product/sun-protection-combo-sunscreen-ubtan-facewash,5,724,3%,80ml,"['saffron', 'turmeric', 'carrot seed oil', 'cucumber extract']","Sun Protection Combo : Sunscreen, 80ml + Ubtan Facewash, 100ml"
"Ultra Light Indian Sunscreen with Carrot Seed, Turmeric & SPF 50 PA+++ - 80ml",https://mamaearth.in/product/mamaearths-ultra-light-indian-sunscreen,4.9,499,0%,80ml,"['carrot seed oil', 'turmeric', 'orange oil', 'cananga oil']","Ultra Light Indian Sunscreen with Carrot Seed, Turmeric & SPF 50 PA+++ - 80ml"
"Overnight Repair Face Cream, 50ml",https://mamaearth.in/product/natural-night-cream,4.3,599,0%,50ml,"['daisy flower', 'saffron']","Overnight Repair Face Cream, 50ml"
Day & Night Cream Combo,https://mamaearth.in/product/mamaearth-day-and-night-cream-combo,4.9,1099,8%,null,"['pomegranate oil', 'moringa oil', 'mulberry extract', 'murumuru butter', 'daisy flower', 'saffron']",Day & Night Cream Combo Natural Radiance day cream & Overnight Repair Face Cream combo Natural Radiance day creamMamaearth’s Overnight Repair cream
