Name,Link,Rating,Price,Discount,Pack,Ingredients,Discription
"Tea Tree Anti Dandruff Hair Mask, 200ml",https://mamaearth.in/product/mamaearth-tea-tree-anti-dandruff-hair-mask,5,599,0%,200ml,"['tea tree oil', 'argan oil', 'lemon oil', 'cedarwood oil']","Tea Tree Anti Dandruff Hair Mask, 200mlMamaearth's Tea Tree Hair Mask helps you soothe the irritating oily and flaky scalp by controlling dandruff, thus giving you an itch-free healthy scalp and nourished hair. Lemon oil & Tea Tree oil make sure that the oil & dandruff are at bay while Coconut oil & Argan oil present in mask moisturize & nourish your hair. No matter what type of hair you have - dry hair, curly hair, colored hair, treated hair, oily hair – Mamaearth Tea Tree Mask suits them all!"
"Healthy Hair Combo : Shampoo, 200ml + Conditioner, 200ml",https://mamaearth.in/product/happy-heads-shampoo-no-more-tangles-conditioner-twin-pack,5,679,3%,200ml,"['biotin', 'horse chestnut', 'amla extract', 'bhringraj extract']","Healthy Hair Combo : Shampoo, 200ml + Conditioner, 200ml"
Ubtan Face Mask with Saffron & Turmeric for Skin Brightening and Tan Removal - 100g,https://mamaearth.in/product/ubtan-face-mask-for-skin-lightening-brightening,4.8,499,0%,100g,"['saffron', 'turmeric', 'apricot oil']","Ubtan Face Mask with Saffron & Turmeric for Skin Brightening and Tan Removal - 100gIndulge in the age-old tradition of Ubtan and let it rejuvenate your face for a fresh, bright, flawless look.

The goodness of Ubtan comprises Turmeric and Saffron – both ingredients that are revered for their benefits in imparting glowing skin and tan removal. Saffron clears spots and helps in tan removal, while the antioxidant properties of Turmeric protect the skin cells from free radical damage while keeping it healthy. Apricot Oil and Cucumber present in the Ubtan Face Mask help exfoliate, soothe and reduce tan for a glowing look.

Mamaearth Ubtan Face Mask is suitable for all skin types and is free of Parabens, Silicones, Sulfates, Phthalates, and Artificial Colors.

"
"Charcoal Secrets : C3 Face Mask, 100ml + Charcoal Facewash, 100ml",https://mamaearth.in/product/charcoal-secrets-c3-face-mask-charcoal-face-wash,4.8,799,6%,100ml,"['charcoal', 'coffee', 'kaolin clay', 'bentonite clay', 'tea tree oil']","Charcoal Secrets : C3 Face Mask, 100ml + Charcoal Facewash, 100ml"
"Natural Radiance Day Cream, 50ml",https://mamaearth.in/product/mamaearth-natural-radiance-day-cream,4.9,599,0%,50ml,"['pomegranate oil', 'moringa oil', 'mulberry extract', 'murumuru butter']","Natural Radiance Day Cream, 50ml"
"Charcoal Facewash for oil control, 100ml",https://mamaearth.in/product/best-charcoal-face-wash,4.8,249,0%,100ml,"['charcoal', 'clay', 'coffee', 'tea tree oil']","Charcoal Facewash for oil control, 100ml"
"Tea Tree Facewash for acne & pimples, 100ml",https://mamaearth.in/product/tea-tree-face-wash,4.9,249,0%,100ml,"['neem', 'aloe vera', 'tea tree oil']","Tea Tree Facewash for acne & pimples, 100ml"
"Ubtan Face Wash for Tan Removal, 100ml",https://mamaearth.in/product/ubtan-face-wash,4.9,249,0%,100ml,"['turmeric', 'walnut beads', 'licorice extract', 'carrot oil']","Ubtan Face Wash for Tan Removal, 100ml"
"Argan Hair Mask with Argan, Avocado Oil, and Milk Protein for Frizz-free & Stronger Hair – 200ml",https://mamaearth.in/product/argan-hair-mask,4.8,599,0%,200ml,"['argan oil', 'avocado oil', 'rosemary oil', 'milk protein']","Argan Hair Mask with Argan, Avocado Oil, and Milk Protein for Frizz-free & Stronger Hair – 200ml"
"C3 Face Mask for healthy & glowing skin, 100ml",https://mamaearth.in/product/buy-charcoal-face-mask,4.8,599,0%,100ml,"['charcoal', 'coffee', 'kaolin clay', 'bentonite clay']","C3 Face Mask for healthy & glowing skin, 100ml"
Anti Hair Fall Kit for complete hair care,https://mamaearth.in/product/anti-hair-fall-kit,4.8,1149,28%,null,"['bhringraj oil', 'biotin', 'cocoa butter', 'korean red ginseng']",Anti Hair Fall Kit for complete hair care
"Shampoo & Bodywash for men, 200ml",https://mamaearth.in/product/natural-shampoo-and-bodywash,4.9,349,0%,200ml,"['caffeine', 'tea tree oil', 'menthol']","Shampoo & Bodywash for men, 200ml"
"Reboot After Shave Lotion, 100ml",https://mamaearth.in/product/mens-aftershave-lotions,4.9,349,0%,100ml,"['green tea', 'witch hazel', 'tea tree oil']","Reboot After Shave Lotion, 100ml"
Hydrating Natural Body Lotion with Cucumber & Aloe Vera for Normal Skin - 250ml,https://mamaearth.in/product/body-lotion-for-normal-skin,5,299,0%,250ml,"['cucumber', 'aloe vera', 'coconut oil', 'shea butter']",Hydrating Natural Body Lotion with Cucumber & Aloe Vera for Normal Skin - 250ml
Tea Tree Anti-Dandruff Hair Regime Kit,https://mamaearth.in/product/tea-tree-anti-dandruff-hair-kit,4.9,999,23%,null,"['tea tree oil', 'agaan oil', 'lemon oil', 'cedarwood oil', 'ginger oil', 'vitamin e', 'almond oil']",Tea Tree Anti-Dandruff Hair Regime Kit
Tea Tree Shampoo for Dandruff Free Hair - 250ml,https://mamaearth.in/product/tea-tree-shampoo-for-dandruff-free-hair-250ml,4.9,349,0%,250ml,"['tea tree oil', 'ginger oil', 'vitamin e']","Tea Tree Shampoo for Dandruff Free Hair - 250mlStimulate and renew your hair with an outlandish mix of Tea Tree and Ginger Oil that helps in reducing itch & irritation while contributing to the health and cleanliness of the scalp and soothing dryness and itchiness.Mamaearth Tea Tree Shampoo is made using natural ingredients and makes sure that dandruff and excess oil is gently worked on & removed. It helps soothe irritating, oily, and flaky scalp by controlling dandruff; thus, giving you an itch-free healthy scalp and nourished hair. Vitamin E present in this shampoo helps maintain hair growth while promoting blood circulation, preventing breakage and deeply moisturizing hair.Safe for colored & chemically treated hair, this shampoo is free of harmful chemicals & toxins such as Silicones, Parabens, Mineral Oil, & Dyes."
Mamaearth Healing Body Lotion with Moroccan Argan and Macadamia Nut Oil for Dry Skin - 250 ml,https://mamaearth.in/product/healing-body-lotion,4.5,299,0%,250ml,"['moroccan argan oil', 'macadamia nut oil', 'olive oil']",Mamaearth Healing Body Lotion with Moroccan Argan and Macadamia Nut Oil for Dry Skin - 250 ml
Vitamin C Face Wash with Vitamin C and Turmeric for Skin Illumination – 250ml,https://mamaearth.in/product/vitamin-c-face-wash-with-vitamin-c-and-turmeric-for-skin-illumination-250ml,5,399,0%,250ml,"['vitamin c', 'turmeric', 'aloe vera']","Vitamin C Face Wash with Vitamin C and Turmeric for Skin Illumination – 250mlThe first step in a skincare routine, cleansing or washing your face, helps eliminate excess oil, dirt, and lethargy.Mamaearth Vitamin C Face Wash with Vitamin C and Turmeric's goodness has brightening properties to give your skin a natural glow. It also helps in skin repair by boosting collagen production and blood circulation, leaving the skin radiant and healthy. Perfect for daily use, this face wash suits all skin types, retains moisture, controls excess oil, and fights free radical damage. Dermatologically tested, this Vitamin C Face Wash has no harmful chemicals and is free of Toxins, Parabens, and Mineral Oils."
Vitamin C Bamboo Sheet Mask with Vitamin C & Honey for Skin Illumination - 25 g,https://mamaearth.in/product/vitamin-c-bamboo-sheet-mask-with-vitamin-c-honey-for-skin-illumination-25-g,5,149,0%,25g,"['vitamin c', 'honey', 'argan oil', 'niacinamide']","Vitamin C Bamboo Sheet Mask with Vitamin C & Honey for Skin Illumination - 25 gNeed that instant Vitamin C glow for your skin? Vitamin C Bamboo Sheet Mask is the pick me up your skin needs! Go, become a glow getter in just 15 minutes.Crafted with the goodness of Vitamin C and Honey, the sheet mask helps fight free-radical damage and reduces dark spots. Honey keeps the skin moisturized and plump. Together, they will make your skin look radiant. Want more? Our sheet masks come packed with nine days of serum hydration, giving you the shot of suppleness it needs.Mamaearth sheet masks are India’s 1st Bamboo-Based Masks, which means they’re gentle and biodegradable - great for your skin and great for the environment. The sheet mask is suitable for all skin types, is free of alcohol & harmful toxins such as Parabens, Mineral Oil, Silicones, etc."
Rose Water Bamboo Sheet Mask with Rose Water & Milk for Glowing Skin - 25 g,https://mamaearth.in/product/rose-water-bamboo-sheet-mask-with-rose-water-milk-for-glowing-skin-25-g,5,149,0%,25g,"['rose water', 'milk', 'niacinamide', 'avocado']","Rose Water Bamboo Sheet Mask with Rose Water & Milk for Glowing Skin - 25 gWake up and smell the roses - quite literally! Everyone wishes for hydrated, healthy, and glowing skin, and it’s time to make those dreams come true. Give your skin the freshness of roses and the brightness of milk with our Rose Water Bamboo Sheet Mask.Fight dehydration and dryness and say goodbye to skin problems like parched skin and dullness because Mamaearth Rose Bamboo Sheet Mask will give your skin a burst of moisture because it’s packed with nine days of serum hydration. Your skin will feel soft and soothed instantly and you’ll notice a natural, healthy glow. This is India’s 1st Bamboo-Based Sheet Mask. It’s gentle on your skin and biodegradable, making it great for you and for the environment. It is suitable for all skin types, is free of alcohol & harmful toxins such as Parabens, Mineral Oil, Silicones, etc."
Ubtan Bamboo Sheet Mask with Turmeric & Saffron for Skin Brightening - 25 g,https://mamaearth.in/product/ubtan-bamboo-sheet-mask-with-turmeric-saffron-for-skin-brightening-25-g,5,149,0%,25g,"['turmeric', 'saffron', 'green tea', 'kiwi']","Ubtan Bamboo Sheet Mask with Turmeric & Saffron for Skin Brightening - 25 gDo you want the traditional goodness of Turmeric and Saffron, without the hassle? Yes, please! Get brighter, more hydrated and fresher looking skin with Ubtan Bamboo Sheet Mask. This sheet mask is super effective as each one comes packed with nine days of serum hydration, making your skin brighter in just 15 minutes. Time to Get, Set, GLOW! Crafted with the goodness of Turmeric and Saffron, the Ubtan Bamboo Sheet Mask will help you win the battle against dull skin, dark spots & pigmentation. Our sheet masks aren’t just good for your skin, they’re environment-friendly too because they’re India’s 1st Bamboo-Based Sheet Masks. They are suitable for all skin types, are free of alcohol & harmful toxins such as Parabens, Mineral Oil, Silicones, etc.Our sheet masks aren’t just good for your skin, they’re environment-friendly too because they’re India’s 1st Bamboo-Based Sheet Masks. They are suitable for all skin types, are free of alcohol & harmful toxins such as Parabens, Mineral Oil, Silicones, etc."
Tea Tree Shampoo + Onion Hair Oil,https://mamaearth.in/product/tea-tree-shampoo-onion-hair-oil,5,724,3%,null,"['tea tree oil', 'ginger oil', 'vitamin e']",Tea Tree Shampoo + Onion Hair Oil
