Name,Link,Rating,Price,Discount,Pack,Ingredients,Discription
Essential Anti-Hair Fall Kit,https://mamaearth.in/product/essential-anti-hair-fall-kit,5,1199,29%,null,"['onion', 'niacinamide', 'keratin', 'redensyl']","Essential Anti-Hair Fall KitTime to say goodbye to hair fall with Mamaearth Essential Anti-Hair Fall Kit! Powered with the goodness of onion, it’s the only defense you need to combat hair fall. Let nature’s goodness be your choice to control hair fall, revive hair, and improve overall hair quality.Loaded with the goodness of ingredients like Onion, Niacinamide, Keratin, Bhringraj, Amla, Pea Sprouts, Redensyl, and Vitamin E – the Essential Anti-Hair Fall Kit improves hair growth and strengthens hair roots. Rich in sulfur content, Onion is an exceptionally powerful ingredient that makes hair stronger and reduces breakage. Niacinamide stimulates blood circulation and promotes faster absorption of nutrients. Mamaearth Essential Anti-Hair Fall Kit is safe for colored & chemically treated hair; the products in this combo are free of harmful chemicals & toxins such as Silicones, Parabens, Mineral Oil & Dyes.Onion Scalp Serum – 50ml Onion Shampoo – 250mlOnion Conditioner – 250ml Onion Oil – 150ml "
Anti-Pollution Kit,https://mamaearth.in/product/anti-pollution-kit,5,999,26%,null,"['coffee', 'cocoa', 'vitamin c', 'aloe vera', 'turmeric']","Anti-Pollution KitFight the odds of dull and uneven skin tone with a revitalizing and rejuvenating skincare regimen prepped to face the forces of nature.Mamaearth Anti-Pollution Kit formulated with natural, antioxidant, and toxin-free ingredients like Cocoa, Coffee, Vitamin C, Aloe Vera & Turmeric keeps your skin immune against pollution, sun, and free radical damage. The products in the kit are gentle, lightweight, non-comedogenic, and highly effective for achieving a clear, smooth, and flawless complexion with religious use.And because of our no toxins and harmful chemicals philosophy, you won’t find any Silicones, Parabens, Mineral Oil & Dyes.Coco Face Scrub - 100gCoCo Face Wash - 100mlVitamin C Toner - 200mlAnti-Pollution Daily Face Cream- 80ml"
Wedding Glow Skin Rejuvenation Kit,https://mamaearth.in/product/wedding-glow-skin-rejuvenation-kit,5,1349,25%,null,"['turmeric', 'saffron', 'mulberry extract', 'aloe vera']","Wedding Glow Skin Rejuvenation KitIt’s time to prep-up for the wedding season with the goodness of Mamaearth. Bring home Mamaearth Wedding Glow Skin Rejuvenation Kit and start your journey to glowing skin with our non-toxic & safe products. Welcome skin that is clean, clear, and glows naturally! Fortified with the healing goodness of Turmeric, skin-brightening effects of Mulberry & Vitamin C, and soothing properties of Aloe Vera, the kit uplifts and lets your inner radiance shine forth, making you look like a dream.Ubtan Face Wash - 100mlUbtan Face Mask- 100gAnti-Pollution Daily Face Cream- 80mlBye Bye Blemishes- 30mlAloe Turmeric Gel- 150ml"
Hyaluronic Bamboo Sheet Mask with Rosehip Oil for Soft & Plump Skin - 25 g,https://mamaearth.in/product/hyaluronic-bamboo-sheet-mask-with-rosehip-oil-for-soft-plump-skin-25-g,5,149,0%,25g,"['hyaluronic acid', 'rosehip oil', 'niacinamide', 'honey']","Hyaluronic Bamboo Sheet Mask with Rosehip Oil for Soft & Plump Skin - 25 gYou asked, we delivered. Meet your ultimate ‘me time’ BFF! Mamaearth Hyaluronic Bamboo Sheet Mask with Hyaluronic Acid and Rosehip Oil. Say hello to skin that’s soft, plump and super hydrated. It’s also quick, easy, and super effective as it comes packed with nine days of serum hydration. Yup, you read that right! The goodness doesn't stop here. The Sheet Mask fights all major signs of aging, and reduces the appearance of open pores. Whether your plans involve a quick outing with friends or a dinner date with your BFF, this sheet mask is your ultimate partner. Mamaearth sheet masks are India’s 1st Bamboo-Based Masks, which makes them skin as well as environment-friendly. It is suitable for all skin types, and is free of alcohol & harmful toxins such as Parabens, Mineral Oil, Silicones, etc."
Retinol Bamboo Sheet Mask with Retinol & Bakuchi for Fine Lines & Wrinkles - 25 g,https://mamaearth.in/product/retinol-bamboo-sheet-mask-with-retinol-bakuchi-for-fine-lines-wrinkles-25-g,5,149,0%,25g,"['retinol', '', '', 'bakuchi', 'vitamin c', 'grape seed']","Retinol Bamboo Sheet Mask with Retinol & Bakuchi for Fine Lines & Wrinkles - 25 gDefy the hands of time and bring back that youthful-looking skin! Say goodbye to fine lines and other signs of aging with Mamaearth Retinol Bamboo Sheet Mask. The super effective sheet mask also packs in nine days of serum hydration in one go, leaving your skin supple and soft.  "
CoCo Bamboo Sheet Mask with Coffee & Cocoa for Skin Awakening - 25 g,https://mamaearth.in/product/coco-bamboo-sheet-mask-with-coffee-cocoa-for-skin-awakening-25-g,5,149,0%,25g,"['coffee', '', 'theobroma cacao', 'niacinamide', 'citric acid']","CoCo Bamboo Sheet Mask with Coffee & Cocoa for Skin Awakening - 25 gKick off your shoes, get comfortable, and reward your skin with an indulgent and hydrating sheet mask, much like a relaxing day at the spa! It’s easy to use, convenient and will unmask thoroughly refreshed and glowing skin in minutes. Our CoCo Sheet Mask is super effective as each one comes packed with nine days of serum hydration, making your skin supple and softer in just 15 minutes. Mamaearth CoCo Bamboo Sheet Mask is crafted with the goodness of Coffee and Cocoa that are loaded with antioxidants and have excellent soothing properties. These together fight free radical damage, restoring and energizing your skin.Our sheet masks are also India’s 1st Bamboo-Based Sheet Masks, which makes them skin as well as environment-friendly. The sheet mask is suitable for all skin types, is free of alcohol & harmful toxins such as Parabens, Mineral Oil, Silicones, etc."
"Pro-Growth Hair Tonic for better hair growth, 100ml",https://mamaearth.in/product/buy-hair-growth-tonic,4.8,499,0%,100ml,"['korean red ginseng', 'caffeine', 'basil oil']","Pro-Growth Hair Tonic for better hair growth, 100ml"
Rice Water Bamboo Sheet Mask with Rice Water & Coconut Milk for Deep Hydration - 25 g ,https://mamaearth.in/product/rice-water-bamboo-sheet-mask-with-rice-water-coconut-milk-for-deep-hydration-25-g,5,149,0%,25g,"['rice water', 'coconut milk', 'argan oil', 'palm extract']","Rice Water Bamboo Sheet Mask with Rice Water & Coconut Milk for Deep Hydration - 25 g Nothing’s as nice as rice for hydrated, nourished, and supple skin! Give your skin a spa treatment in just 15 minutes with Mamaearth Rice Water Bamboo Sheet Mask. Crafted with the goodness of Rice Water and Coconut, the sheet mask has ingredients that are extremely hydrating, help clear patchy skin, and encourage skin brightening. Rice Water is filled with amino acids, which makes the skin brighter while Coconut promotes firmness, making skin look smoother and softer. Plus the sheet mask comes packed with nine days of serum hydration. This is India’s 1st Bamboo-Based Sheet Mask. It’s gentle on your skin and biodegradable, making it great for you and for the environment. It is suitable for all skin types, is free of alcohol & harmful toxins such as Parabens, Mineral Oil, Silicones, etc.This is India’s 1st Bamboo-Based Sheet Mask. It’s gentle on your skin and biodegradable, making it great for you and for the environment. It is suitable for all skin types, is free of alcohol & harmful toxins such as Parabens, Mineral Oil, Silicones, etc."
"Root Restore Hair Oil for hair fall reduction, 100ml",https://mamaearth.in/product/buy-natural-hair-oil,4.8,399,0%,100ml,"['bhringraj oil', 'rosemary oil', 'vitamin e']","Root Restore Hair Oil for hair fall reduction, 100ml"
"Happy Heads Shampoo for healthy & stronger hair, 200ml",https://mamaearth.in/product/buy-organic-shampoo-online,4.8,349,0%,200ml,"['biotin', 'horse chestnut', 'amla extract', 'bhringraj extract']","Happy Heads Shampoo for healthy & stronger hair, 200ml"
Niacinamide Bamboo Sheet Mask with Niacinamide & Ginger Extract for Clear & Glowing Skin - 25 g,https://mamaearth.in/product/niacinamide-bamboo-sheet-mask-with-niacinamide-ginger-extract-for-clear-glowing-skin-25-g,5,149,0%,25g,"['niacinamide', 'ginger extract', 'tea tree oil', 'citric acid']","Niacinamide Bamboo Sheet Mask with Niacinamide & Ginger Extract for Clear & Glowing Skin - 25 gSheet masks are a super satisfying, convenient, and fun way to give your skin some TLC at home. Your skin gets an instant boost of suppleness because each sheet mask is packed with nine days of serum hydration. Formulated with the power of Niacinamide and Ginger, the sheet mask will also help your skin tone and texture, and it’s proven to reduce acne marks & scars.Mamaearth sheet masks are extremely gentle and safe for you because they are made from bamboo, unlike other sheet masks that are made of polyester - a first for India. They’re biodegradable, making them good for you and good for the environment! The sheet mask is suitable for all skin types, is free of alcohol & harmful toxins such as Parabens, Mineral Oil, Silicones, etc."
Charcoal Facial Regimen Kit,https://mamaearth.in/product/charcoal-facial-regimen-kit,5,899,25%,null,"['activated charcoal', 'coffee', 'walnut', 'tea tree']","Charcoal Facial Regimen KitAre the day’s toils clogging your skin and making it uncomfortable? Fret not, Mamaearth Charcoal Facial Regimen Kit is nature’s way of bidding goodbye to dull, tired & fatigued skin. The kit is travel-friendly, easy to use, and reliable for fighting acne, blemishes, and even detoxifies your skin. TBH, you can never go wrong with the age-old & natural ingredients like Charcoal, Coffee, Walnut & Clay - all of which are gentle but very effective in skin clearing and rejuvenation while making your skin healthy and glowing. And because of our no toxins and harmful chemicals philosophy, you won’t find any Silicones, Parabens, Mineral Oil & Dyes.And because of our no toxins and harmful chemicals philosophy, you won’t find any Silicones, Parabens, Mineral Oil & Dyes.Charcoal Face Wash - 100gCharcoal Face Scrub - 100mlC3 Face Mask - 100ml"
Charcoal Face Wash & Scrub Combo,https://mamaearth.in/product/charcoal-face-wash-scrub-combo,5,584,2%,null,"['activated charcoal', 'coffee', 'walnut', 'tea tree']","Charcoal Face Wash & Scrub ComboStress, pollution, dirt, and grime can take a toll on your skin’s health. The new Mamaearth Charcoal Face Wash & Scrub Combo is here to hug your skin and pull out all the negativity, lethargy, and dullness only to replace it with joy, cheer, and sunshine! This naturally formulated combo contains Activated Charcoal, Coffee & Walnut to remove toxins, clarify and purify skin back to health. And because of our no toxins and harmful chemicals philosophy, you won’t find any Silicones, Parabens, Mineral Oil & Dyes.And because of our no toxins and harmful chemicals philosophy, you won’t find any Silicones, Parabens, Mineral Oil & Dyes.Charcoal Face Wash - 100gCharcoal Face Scrub - 100ml"
CoCo Face Wash with Coffee & Cocoa for Skin Awakening – Pack of 2,https://mamaearth.in/product/coco-face-wash-with-coffee-cocoa-for-skin-awakening-pack-of-2,5,489,2%,null,"['coffee', 'cocoa']","CoCo Face Wash with Coffee & Cocoa for Skin Awakening – Pack of 2The combination of Cocoa and Coffee not only makes a heartwarming cuppa but also gives a radiant boost when used on the skin.Mamaearth CoCo Face Wash is packed with antioxidant, anti-inflammatory, and anti-aging ingredients. It tightens pores, reverses sun damage, and stimulates blood flow leaving you with even-toned and healthy skin. Coffee increases collagen production to give your skin a youthful appearance. While Cocoa softens and detoxifies the skin to reduce fine lines, wrinkles, and the appearance of scars.And because of our no toxins and harmful chemicals philosophy, you won’t find any Silicones, Parabens, Mineral Oil & Dyes.And because of our no toxins and harmful chemicals philosophy, you won’t find any Silicones, Parabens, Mineral Oil & Dyes."
Onion Shampoo + Onion Hair Serum ,https://mamaearth.in/product/onion-shampoo-onion-hair-serum,5,634,2%,null,"['red onion', 'biotin', 'olive oil', 'd-panthenol']","Onion Shampoo + Onion Hair Serum Beat hair fall with the goodness of Onion. Start your day with Mamaearth Onion Hair Shampoo and follow up with Mamaearth Onion Hair Serum to combat hair fall the natural way. Loaded with natural ingredients like Onion, Biotin, Keratin, and Vitamin E – the combination of Shampoo & Serum works effectively to address hair fall issues that stem due to stress, pollution & unhealthy lifestyle choices. Onion – rich in sulfur makes hair stronger & reduces breakage, while Biotin improves the hair quality to increase thickness. Plant Keratin – a gold standard in hair care replenishes and strengthens hair by repairing its natural structure. An age-old remedy, the combo is the perfect choice for anyone looking to revive their hair, reduce hair fall, breakage & improve overall hair quality. And because of our no toxins and harmful chemicals philosophy, you won’t find any Silicones, Parabens, Mineral Oil & Dyes.An age-old remedy, the combo is the perfect choice for anyone looking to revive their hair, reduce hair fall, breakage & improve overall hair quality. And because of our no toxins and harmful chemicals philosophy, you won’t find any Silicones, Parabens, Mineral Oil & Dyes.Onion Shampoo - 250ml Onion Hair Serum - 100ml"
Hair Fall Reduction Combo,https://mamaearth.in/product/hair-fall-reduction-combo,5,1199,8%,null,"['onion seed oil', 'redensyl', 'keratin', 'vitamin e', 'coconut']","Hair Fall Reduction ComboHair is like a couture fabric in need of unconditional TLC. But, the constant tug, stretch & sweat can take a toll on its health, leading to thinning and breakage. This Hair Fall Reduction Combo is a powerful trio of nourishment, strengthening & conditioning put together to fight hair loss and encourage healthy hair growth.  It contains hardworking & natural ingredients like Onion Seed Oil, Redensyl, Keratin, Vitamin E & Coconut. Redeem your hair goals with this deeply restorative hair care combo & turn heads!And because of our no toxins and harmful chemicals philosophy, you won’t find any Silicones, Parabens, Mineral Oil & Dyes.And because of our no toxins and harmful chemicals philosophy, you won’t find any Silicones, Parabens, Mineral Oil & Dyes.Onion Oil - 250ml Onion Shampoo - 250ml Onion Conditioner - 250ml "
Onion Shampoo & Oil Combo,https://mamaearth.in/product/onion-shampoo-oil-combo,5,924,3%,null,"['onion seed oil', 'redensyl', 'keratin', 'vitamin e']","Onion Shampoo & Oil ComboOne...Two...Three...One Hundred & Fifty! They say it’s natural to lose up to 150 strands of hair a day. However, many natural factors like stress, pollution, sweat, etc. lead to unnatural hair fall, greying, and thinning. This combo comes prepped with the benefits of Onion & Redensyl to unblock hair follicles & boost new hair growth while Plant Keratin replenishes the scalp with proteins, restoring smoothness & shine. So, why wait? Take care of your crowning glory with the help of naturally nourishing, conditioning, and growth restoring ingredients. And because of our no toxins and harmful chemicals philosophy, you won’t find any Silicones, Parabens, Mineral Oil & Dyes.And because of our no toxins and harmful chemicals philosophy, you won’t find any Silicones, Parabens, Mineral Oil & Dyes.Onion Oil - 250ml Onion Shampoo - 250 ml "
Onion Shampoo for Hair Growth & Hair Fall Control (250 ml) - Pack Of 2,https://mamaearth.in/product/onion-shampoo-for-hair-growth-hair-fall-control-250-ml-pack-of-2,5,679,3%,250ml,"['onion seed oil', 'd-panthenol', 'plant keratin', 'vitamin e']","Onion Shampoo for Hair Growth & Hair Fall Control (250 ml) - Pack Of 2Good hair speaks louder than words! Mamaearth Onion Shampoo fights against the damaging effects of stress, pollution, and UV with natural hair boosting ingredients like Onion, Keratin & Vitamin E to help you achieve ultimate hair goals! This shampoo introduces your scalp to a cleaner and healthier status quo, making the next phase of hair growth stronger, longer, thicker & voluminous! The goodness of natural ingredients help control hair fall while boosting hair growth.And because of our no toxins and harmful chemicals philosophy, you won’t find any Silicones, Parabens, Mineral Oil & Dyes.And because of our no toxins and harmful chemicals philosophy, you won’t find any Silicones, Parabens, Mineral Oil & Dyes."
"No More Tangles Conditioner for fizz free hair, 200ml",https://mamaearth.in/product/buy-hair-conditioner-online,4.9,349,0%,200ml,"['cocoa butter', 'shea butter', 'amla extract', 'fenugreek extract']","No More Tangles Conditioner for fizz free hair, 200mlFrizz & "
Spotless Skin Combo: Ubtan Facewash - 100ml + Bye Bye Blemishes Face Cream - 30ml,https://mamaearth.in/product/spotless-skin-combo,5,679,3%,100ml,"['walnut beads', 'liquorice extract', 'carrot seed oil', 'mulberry extract', 'daisy flower', 'geranium oil']",Spotless Skin Combo: Ubtan Facewash - 100ml + Bye Bye Blemishes Face Cream - 30ml
Anti-Acne Kit,https://mamaearth.in/product/anti-acne-kit,4.9,849,26%,null,"['apple cider vinegar', 'niacinamide', 'neem', 'glycerin']",Anti-Acne Kit
Onion Scalp Serum with Onion & Niacinamide for Healthy Hair Growth – 50ml,https://mamaearth.in/product/onion-scalp-serum-with-onion-niacinamide-for-healthy-hair-growth-50ml,5,599,0%,50ml,"['red onion', 'niacinamide', 'pea sprouts', 'aloe vera juice']",Onion Scalp Serum with Onion & Niacinamide for Healthy Hair Growth – 50ml
Vitamin C Body Lotion with Vitamin C & Honey for Radiant Skin – 400 ml  ,https://mamaearth.in/product/vitamin-c-body-lotion-with-vitamin-c-honey-for-radiant-skin-400-ml,4.9,399,0%,400ml,"['vitamin c', 'honey', 'shea butter', 'olive oil']","Vitamin C Body Lotion with Vitamin C & Honey for Radiant Skin – 400 ml  It’s time to give your skin the comfort and love it deserves with the goodness of Vitamin C, Honey, Shea Butter & Olive Oil. Say hello to radiant skin with Vitamin C and bid adieu to dull and uneven skin tone.Mamaearth Vitamin C Body Lotion deeply nourishes and soothes, and boosts collagen to give you radiant looking skin. Vitamin C also protects the skin against free radical damage and evens out skin tone. The fresh and non-greasy formula captures will give your skin the long-lasting hydration it needs. Suitable for all skin types, Mamaearth Vitamin C Body Lotion has no harmful chemicals and is free of Parabens, toxins, and mineral oils."
Ubtan Body Lotion with Turmeric & Kokum Butter for Glowing Skin – 400 ml,https://mamaearth.in/product/ubtan-body-lotion-with-turmeric-kokum-butter-for-glowing-skin-400-ml,5,399,0%,400ml,"['turmeric', 'kokum butter', 'shea butter', 'olive oil']","Ubtan Body Lotion with Turmeric & Kokum Butter for Glowing Skin – 400 mlWhat is love? Soft, supple, hydrated, and glowing skin. Relax and give your body the nourishing and moisturizing benefits of Turmeric, Kokum Butter, Shea Butter & Olive Oil.Mamaearth Ubtan Body Lotion replenishes your skin while reviving its natural glow. The rich body lotion, accompanied by an earthy aroma, sinks deep into the skin’s layers and keeps it hydrated for a long time. With this body lotion by your side, you can tell dryness to stay away. Suitable for normal skin, Mamaearth Ubtan Body Lotion has no harmful chemicals and is free of Parabens, toxins, and mineral oils."
CoCo Body Lotion With Coffee and Cocoa for Intense Moisturization - 400ml ,https://mamaearth.in/product/coco-body-lotion-with-coffee-and-cocoa-for-intense-moisturization-400ml,4.9,399,0%,400ml,"['coffee', 'cocoa butter', 'shea butter', 'olive oil']","CoCo Body Lotion With Coffee and Cocoa for Intense Moisturization - 400ml Wake up and smell the coffee - literally! If your skin is parched and needs that extra boost of intense moisturization, CoCo Body Lotion is what you need. Enriched with the natural goodness of Coffee and Cocoa, the body lotion is as indulgent as it is nourishing. And it smells absolutely delicious. This is, quite literally, food for your skin.  Coffee adds richness while Cocoa Butter, Shea Butter, and Olive Oil provide nourishment and moisture. At the same time, the lotion is extremely lightweight, absorbs quickly and doesn’t feel greasy. Make dry, dehydrated, and flaky skin a thing of the past. Our CoCo Body Lotion is excellent for dry skin and is free of Parabens, Silicones, Sulfates, Phthalates, and Artificial Colors."
Rose Body Lotion with Rose Water and Milk For Deep Hydration - 400ml,https://mamaearth.in/product/rose-body-lotion-with-rose-water-and-milk-for-deep-hydration-400ml,5,399,0%,400ml,"['rose water', 'milk', 'shea butter', 'olive oil']","Rose Body Lotion with Rose Water and Milk For Deep Hydration - 400mlScore a perfect ten when it comes to hydrated skin with your newest #skincrush - Rose Body Lotion. A delicious smelling, super light but hydrating body lotion, it’s a sensorial treat for your skin. The Rose Body Lotion is crafted with the fresh goodness of Rose Water and Milk. Rose Water, packed with antioxidants, soothes the skin while Milk locks in the moisture that Shea Butter and Olive Oil provide. It will make your skin soft, supple and hydrated. With this body lotion, make dryness a thing of the past and flaunt moisturized skin that gleams.Mamaearth Rose Body Lotion is suitable for oily skin & free of alcohol & harmful toxins such as Parabens, Mineral Oil, Silicones, etc"
Vitamin C Foaming Face Wash with Vitamin C & Turmeric for Skin Illumination – 150ml,https://mamaearth.in/product/vitamin-c-foaming-face-wash-with-vitamin-c-turmeric-for-skin-illumination-150ml,4.9,399,0%,150ml,"['vitamin c', 'turmeric', 'cucumber', 'aloe vera']","Vitamin C Foaming Face Wash with Vitamin C & Turmeric for Skin Illumination – 150mlGentle clouds of frothy foams infused with the goodness of Vitamin C and Turmeric - that’s Mamaearth Vitamin C Foaming Face Wash for you.Fresh and effective, Mamaearth Vitamin C Foaming Face Wash is loaded with antioxidants as well as brightening and acne preventing properties. Plus, it comes with a super-efficient built-in brush that massages while cleansing. With dollops of cooling benefits thanks to Cucumber and Aloe Vera, this foaming face wash is like a shot of freshness. Use it in the morning to prepare your skin or wash off the toils of the day at night, this is the breath of freshness your skin needs. It comes with a brush applicator that makes application easy, effective and helps Vitamin C and Turmeric to penetrate deep within the skin.Dermatologically tested, this Vitamin C Foaming Face Wash has no harmful chemicals and is free of Toxins, Parabens, and Mineral Oils."
Rose Face Toner with Witch Hazel & Rose Water for Pore Tightening - 200ml,https://mamaearth.in/product/rose-face-toner-with-witch-hazel-rose-water-for-pore-tightening-200ml,4.9,399,0%,200ml,"['rose water', 'cucumber', 'aloe vera', 'witch hazel']",Rose Face Toner with Witch Hazel & Rose Water for Pore Tightening - 200ml
Ubtan Hand Cream with Turmeric and Honey for Deep Moisturization – 50g,https://mamaearth.in/product/ubtan-hand-cream-with-turmeric-and-honey-for-deep-moisturization-50g,5,349,0%,50g,"['turmeric', 'honey', 'shea butter', 'glycerin']",Ubtan Hand Cream with Turmeric and Honey for Deep Moisturization – 50g
Vitamin C Hand Cream with Vitamin C and Shea Butter for Intense Moisturization,https://mamaearth.in/product/vitamin-c-hand-cream-with-vitamin-c-and-shea-butter-for-intense-moisturization,5,349,0%,null,"['vitamin c', 'shea butter', 'glycerin']",Vitamin C Hand Cream with Vitamin C and Shea Butter for Intense Moisturization
CoCo Hand Cream with Coffee & Cocoa for Rich Moisturization – 50g,https://mamaearth.in/product/coco-hand-cream-with-coffee-cocoa-for-rich-moisturization-50g,5,349,0%,50g,"['cocoa', 'coffee', 'shea butter', 'glycerin']",CoCo Hand Cream with Coffee & Cocoa for Rich Moisturization – 50g
Micellar Water Foaming Makeup Remover with Rose Water & Glycolic Acid for Makeup Cleansing – 150 ml,https://mamaearth.in/product/micellar-water-foaming-makeup-remover-with-rose-water-glycolic-acid-for-makeup-cleansing-150-ml,5,399,0%,150ml,"['rose water', 'glycolic acid', 'glycerin']",Micellar Water Foaming Makeup Remover with Rose Water & Glycolic Acid for Makeup Cleansing – 150 ml
Vitamin C Face Milk with Vitamin C and Peach for Skin Illumination – 100 ml,https://mamaearth.in/product/vitamin-c-face-milk-with-vitamin-c-and-peach-for-skin-illumination-100-ml,5,449,0%,100ml,"['vitamin c', 'peach', 'niacinamide', 'portulaca oleracea']",Vitamin C Face Milk with Vitamin C and Peach for Skin Illumination – 100 ml
Argan Shampoo & Conditioner Combo,https://mamaearth.in/product/argan-shampoo-argan-conditioner,5,679,3%,null,"['argan oil', 'apple cider vinegar', 'vitamin e']",Argan Shampoo & Conditioner Combo
Argan Hair Mask & Argan Shampoo,https://mamaearth.in/product/argan-hair-mask-argan-shampoo,5,924,3%,null,"['argan oil', 'apple cider vinegar', 'avocado oil']",Argan Hair Mask & Argan Shampoo
Tan Removal Combo,https://mamaearth.in/product/ubtan-face-scrub-ubtan-face-wash,5,589,2%,null,"['turmeric', 'walnut', 'carrot oil', 'sa?ron']",Tan Removal Combo
BhringAmla Shampoo & Conditioner Combo,https://mamaearth.in/product/bhringamla-shampoo-and-conditioner-combo,5,679,3%,null,"['bhringraj', 'amla', 'shikakai', 'sweet almond oil']",BhringAmla Shampoo & Conditioner Combo
Ubtan Body Scrub with Turmeric & Saffron for Tan Removal – 200 g,https://mamaearth.in/product/ubtan-body-scrub-with-turmeric-saffron-for-tan-removal-200-g,5,499,0%,200g,"['turmeric', 'sa?ron', 'walnut']",Ubtan Body Scrub with Turmeric & Saffron for Tan Removal – 200 g
